{
  "$schema": "../../schemas/module_manifest.schema.json",
  "schema_version": "1.0.0",
  "content_version": "1.0.0",
  "module_id": "physics",
  "subject": "Physics",
  "title": "Physics",
  "summary": "Foundational motion concepts and a minimal gravity demo for V1.",
  "primary_mode_ref": "mode_profile.json",
  "sections": [
    {
      "section_id": "motion",
      "title": "Motion",
      "manifest_path": "sections/motion/section_manifest.json",
      "order": 1
    }
  ]
}
